{
  "$schema": "http://json-schema.org/draft-04/schema#",
  "definitions": {
    "orderedItem": {
      "type": "object",
      "properties": {
        "orderItemNumber": {
          "type": "string",
          "pattern": "^[0-9]+$"
        },
        "orderQuantity": {
          "type": "integer",
          "minimum": 0,
          "maximum": 999
        },
        "productID": {
          "type": "string",
          "pattern": "^[0-9]+$"
        },
        "category": {
          "type": "string",
          "enum": [
            "book",
            "camera",
            "computer"
          ]
        },
        "price": {
          "type": "integer",
          "minimum": 1
        }
      },
      "required": [
        "orderItemNumber",
        "orderQuantity",
        "productID",
        "category",
        "price"
      ]
    }
  },
  "title": "Order",
  "type": "object",
  "properties": {
    "orderNumber": {
      "type": "string",
      "pattern": "^[0-9]+$"
    },
    "orderDate": {
      "type": "string",
      "pattern": "^[0-9]{4}-[0-9]{2}-[0-9]{2}$"
    },
    "isGift": {
      "type": "boolean"
    },
    "orderedItem": {
      "type": "array",
      "minItems": 1,
      "maxItems": 3,
      "uniqueItems": true,
      "items": {
        "$ref": "#/definitions/orderedItem"
      }
    }
  },
  "required": [
    "orderNumber",
    "orderDate",
    "orderedItem"
  ]
}
